<?xml version="1.0" encoding="UTF-8"?>
<?xml-stylesheet type="text/xsl" href="./taller.xsl"?>

<taller xmlns:xsi="http://www.w3.org/2001/XMLSchema-instance"
         xsi:noNamespaceSchemaLocation="orden.xsd">

    <orden numero="R201" urgente="true">

        <marca>Volkswagen</marca>
        <modelo>Golf</modelo>
        <anio>2020</anio>

        <fecha>2026-05-07</fecha>

        <servicios>

            <item>
                <descripcion>Cambio de batería</descripcion>
                <coste>145.90</coste>
            </item>

            <item>
                <descripcion>Revisión general</descripcion>
                <coste>80.50</coste>
            </item>

        </servicios>

        <estado>en_proceso</estado>

    </orden>

    <orden numero="R202">

        <marca>Renault</marca>
        <modelo>Clio</modelo>
        <anio>2016</anio>

        <fecha>2026-05-05</fecha>

        <servicios>

            <item>
                <descripcion>Sustitución de neumáticos</descripcion>
                <coste>320.75</coste>
            </item>

        </servicios>

        <estado>finalizado</estado>

    </orden>

    <orden numero="R203" urgente="false">

        <marca>BMW</marca>
        <modelo>Serie 1</modelo>
        <anio>2019</anio>

        <fecha>2026-05-01</fecha>

        <servicios>

            <item>
                <descripcion>Cambio de pastillas de freno</descripcion>
                <coste>95.99</coste>
            </item>

            <item>
                <descripcion>Diagnóstico electrónico</descripcion>
                <coste>60.00</coste>
            </item>

        </servicios>

        <estado>pendiente</estado>

    </orden>

</taller>